{"$id":"https://locus.invalid/schemas/managed-performance-preflight-v1.schema.json","$schema":"https://json-schema.org/draft/2020-12/schema","additionalProperties":false,"properties":{"arm_id":{"const":"appss-3of5"},"block":{"const":1},"collection_authorized":{"const":false},"decision_id":{"const":"D031"},"evidence_eligible":{"const":false},"format_id":{"const":"LOCUS-managed-performance-preflight-v1"},"measured_slot_count":{"const":26},"prerequisite_for_retention":{"const":true},"retention":{"const":"prohibited"},"scenario_ids":{"const":["AP00","AP01","AP02","AP03","AP04","AP05","AP06"]},"scheduled_slot_count":{"const":27},"status":{"const":"assigned-preparation-only"}},"required":["format_id","decision_id","arm_id","block","scenario_ids","scheduled_slot_count","measured_slot_count","evidence_eligible","retention","prerequisite_for_retention","collection_authorized","status"],"type":"object"}
