{"arm_id":"appss-3of5","block":1,"collection_authorized":false,"decision_id":"D031","evidence_eligible":false,"format_id":"LOCUS-managed-performance-preflight-v1","measured_slot_count":26,"prerequisite_for_retention":true,"retention":"prohibited","scenario_ids":["AP00","AP01","AP02","AP03","AP04","AP05","AP06"],"scheduled_slot_count":27,"status":"assigned-preparation-only"}
